{"target_gate": {"bc_unit": "io_uring_io_uring.pre.bc", "function": "io_file_get_fixed", "branch_instruction_id": ""}, "terms": [{"class": "activation", "object": "io_ring_ctx", "field_ref": "io_ring_ctx.nr_user_files", "relation": "(unsigned int)fd < ctx->nr_user_files must hold to fall through past the if (unlikely((unsigned int)fd >= ctx->nr_user_files)) goto out; branch and reach the fixed-file lookup", "align_target": "", "source": "slice", "confidence": "high", "uncertain": false}, {"class": "premise", "object": "io_ring_ctx", "field_ref": "io_ring_ctx.nr_user_files", "relation": "ctx->nr_user_files > 0, set by a prior io_sqe_files_register() incrementing nr_user_files once per registered slot", "align_target": "", "source": "slice+ledger", "confidence": "high", "uncertain": false}, {"class": "premise", "object": "io_ring_ctx", "field_ref": "io_ring_ctx.file_data", "relation": "ctx->file_data must be non-NULL, i.e. files were registered via a prior successful io_sqe_files_register()", "align_target": "", "source": "slice+ledger", "confidence": "medium_high", "uncertain": false}, {"class": "premise", "object": "io_ring_ctx", "field_ref": "io_ring_ctx.file_table", "relation": "ctx->file_table must be allocated (via io_alloc_file_tables in prior io_sqe_files_register())", "align_target": "", "source": "slice+ledger", "confidence": "medium_high", "uncertain": false}, {"class": "param_align", "object": "io_kiocb", "field_ref": "io_ring_ctx.nr_user_files", "relation": "the submitted fd parameter must align with the registered-file index space: 0 <= fd < the nr_args count registered by the prior io_sqe_files_register()", "align_target": "io_sqe_files_register.nr_args (number of registered fixed files)", "source": "slice+ledger", "confidence": "medium", "uncertain": true}], "abstain": false, "alt_candidates": []}
