{
  "target_gate": {
    "bc_unit": "io_uring_msg_ring.pre.bc",
    "function": "io_msg_ring"
  },
  "terms": [
    {
      "class": "premise",
      "object": "io_ring_ctx",
      "field_ref": "io_ring_ctx.file_data",
      "relation": "ctx has a registered file table (prior io_uring_register IORING_REGISTER_FILES)",
      "align_target": "",
      "source": "slice+ledger",
      "confidence": "high",
      "uncertain": false
    },
    {
      "class": "activation",
      "object": "io_ring_ctx",
      "field_ref": "io_ring_ctx.nr_user_files",
      "relation": "msg->src_fd < ctx->nr_user_files",
      "align_target": "",
      "source": "slice",
      "confidence": "high",
      "uncertain": false
    },
    {
      "class": "param_align",
      "object": "io_ring_ctx",
      "field_ref": "io_ring_ctx.nr_user_files",
      "relation": "submission fixed-file index must be below the registered file count",
      "align_target": "msg->src_fd < nr_args of prior io_uring_register(IORING_REGISTER_FILES, nr_args)",
      "source": "inferred",
      "confidence": "medium_high",
      "uncertain": false
    }
  ],
  "abstain": false,
  "alt_candidates": []
}