{
  "target_gate": {"bc_unit": "io_uring_rw.pre.bc", "function": "io_prep_rw"},
  "terms": [
    {"class": "premise", "object": "io_ring_ctx", "field_ref": "io_ring_ctx.buf_data",
     "relation": "ctx has registered buffers (prior io_uring_register IORING_REGISTER_BUFFERS)",
     "align_target": "", "source": "slice+ledger", "confidence": "high", "uncertain": false},
    {"class": "activation", "object": "io_ring_ctx", "field_ref": "io_ring_ctx.nr_user_bufs",
     "relation": "req->buf_index < ctx->nr_user_bufs", "align_target": "", "source": "slice", "confidence": "high", "uncertain": false},
    {"class": "param_align", "object": "io_ring_ctx", "field_ref": "io_ring_ctx.nr_user_bufs",
     "relation": "submission buffer index must be below the registered buffer count",
     "align_target": "sqe->buf_index < nr_args of prior io_uring_register(IORING_REGISTER_BUFFERS, nr_args)",
     "source": "inferred", "confidence": "medium_high", "uncertain": false}
  ],
  "abstain": false, "alt_candidates": []
}
